{
  "schema_version": 1,
  "story_slug": "last-island-active",
  "enabled": true,
  "status": "CURATED_REFERENCE_NOT_CANON",
  "fields": [
    "owner_character_ref",
    "owner_group_ref",
    "location_refs",
    "footprint",
    "main_material",
    "construction",
    "rooms",
    "interior_fixtures",
    "roof_cover",
    "floors",
    "stairs",
    "doors_routes",
    "main_pillar",
    "visible_condition",
    "construction_summary",
    "reported_damage",
    "damage",
    "repair",
    "furnace",
    "defensive_extensions",
    "world_time",
    "quantities",
    "door_strength",
    "roof_layers"
  ],
  "sources": [
    {
      "id": "SRC-TIMELINE",
      "path": "bible/BASE_TIMELINE.md",
      "git_blob_sha": "6ad780ff895556e0352fc53bf80dfae58078e9b7",
      "status": "LOCAL_REFERENCE",
      "supporting_sources": []
    },
    {
      "id": "SRC-EP1",
      "path": "drafts/EP-001/CH-01-FULL-DRAFT.md",
      "git_blob_sha": "6ea5c611d2224479a02fb491cb0503240e9387af",
      "status": "AUTHOR_ACCEPTED_SOURCE_NOT_GITHUB_APPROVED",
      "supporting_sources": []
    },
    {
      "id": "SRC-EP2",
      "path": "drafts/EP-002/CH-02-FULL-DRAFT.md",
      "git_blob_sha": "973c2385644832640e2cae213b12852942c20912",
      "status": "AUTHOR_ACCEPTED_SOURCE_NOT_GITHUB_APPROVED",
      "supporting_sources": []
    },
    {
      "id": "SRC-EP3",
      "path": "drafts/EP-003/CH-03-FULL-DRAFT.md",
      "git_blob_sha": "b2a7fce4e9113a74c6fe8a3d54ce9f2d624bb452",
      "status": "DRAFT_SOURCE",
      "supporting_sources": []
    },
    {
      "id": "SRC-EP4",
      "path": "drafts/EP-004/CH-04-FULL-DRAFT.md",
      "git_blob_sha": "5851481c2b29bda87f52ee41fe0ce307b07d3169",
      "status": "DRAFT_SOURCE",
      "supporting_sources": []
    },
    {
      "id": "SRC-EP5",
      "path": "drafts/EP-005/CH-05-FULL-DRAFT.md",
      "git_blob_sha": "5dce7134bc2a4982f301d7d0a71635d1631f7d3a",
      "status": "AUTHOR_CHAT_ACCEPTED_WORKING_DRAFT",
      "supporting_sources": []
    },
    {
      "id": "SRC-END3",
      "path": "data/draft_continuity_ep003.json",
      "git_blob_sha": "028ce50542ac02c3c7381558db8070ff886c2308",
      "status": "DRAFT_SOURCE",
      "supporting_sources": [
        "SRC-EP3"
      ]
    },
    {
      "id": "SRC-END5",
      "path": "data/draft_continuity_ep005.json",
      "git_blob_sha": "91891dd39dfe728d04084863a4c13f4525da16d7",
      "status": "AUTHOR_CHAT_ACCEPTED_WORKING_DRAFT",
      "supporting_sources": [
        "SRC-EP5"
      ]
    },
    {
      "id": "SRC-SC20",
      "path": "drafts/EP-003/SC-020.md",
      "git_blob_sha": "6c9bb3b5c957fa0e988020b6c899d1e804134dd8",
      "status": "DRAFT_SOURCE",
      "supporting_sources": []
    },
    {
      "id": "SRC-SC34",
      "path": "drafts/EP-004/SC-034.md",
      "git_blob_sha": "067efce20b5c2b7bffdacd05bb4517e45fde1306",
      "status": "DRAFT_SOURCE",
      "supporting_sources": []
    },
    {
      "id": "SRC-SC35",
      "path": "drafts/EP-004/SC-035.md",
      "git_blob_sha": "0a095972989720028f42ffb4d9cea66de64ed28e",
      "status": "DRAFT_SOURCE",
      "supporting_sources": []
    },
    {
      "id": "SRC-SC36",
      "path": "drafts/EP-004/SC-036.md",
      "git_blob_sha": "fe5a14120b1c015253bb54174c1639a9eafbaf08",
      "status": "DRAFT_SOURCE",
      "supporting_sources": []
    },
    {
      "id": "SRC-SC37",
      "path": "drafts/EP-004/SC-037.md",
      "git_blob_sha": "375ab86e70b302d46f175f5bc618f6926f273693",
      "status": "DRAFT_SOURCE",
      "supporting_sources": []
    },
    {
      "id": "SRC-SC38",
      "path": "drafts/EP-004/SC-038.md",
      "git_blob_sha": "bd5475778623ff572891545dc925300fe767ec1d",
      "status": "DRAFT_SOURCE",
      "supporting_sources": []
    },
    {
      "id": "SRC-SC39",
      "path": "drafts/EP-005/SC-039.md",
      "git_blob_sha": "ff2278819a6cdcab96792d33c6e23a859c09f0ad",
      "status": "AUTHOR_CHAT_ACCEPTED_WORKING_DRAFT",
      "supporting_sources": []
    },
    {
      "id": "SRC-SC43",
      "path": "drafts/EP-005/SC-043.md",
      "git_blob_sha": "2180bf1aeee53fe9713d4a9d5b7b843ebf8d08cb",
      "status": "AUTHOR_CHAT_ACCEPTED_WORKING_DRAFT",
      "supporting_sources": []
    },
    {
      "id": "SRC-SC47",
      "path": "drafts/EP-005/SC-047.md",
      "git_blob_sha": "b6c9150eeabd4f9eec4d55bbb23b046e5c0d8551",
      "status": "AUTHOR_CHAT_ACCEPTED_WORKING_DRAFT",
      "supporting_sources": []
    },
    {
      "id": "SRC-CHARACTERS",
      "path": "data/characters.json",
      "git_blob_sha": "9d321f7898e59db31b819e69fa1cd87e4f7b755e",
      "status": "LOCAL_REFERENCE",
      "supporting_sources": []
    },
    {
      "id": "SRC-LOCATIONS",
      "path": "data/locations.json",
      "git_blob_sha": "1fee4a93a710944a2476ec9b585396a6bb00ebcb",
      "status": "LOCAL_REFERENCE",
      "supporting_sources": []
    },
    {
      "id": "SRC-SCENES",
      "path": "data/scenes.json",
      "git_blob_sha": "63fcb7e21d69824f4235e8f042608a4b6e6cc486",
      "status": "LOCAL_REFERENCE",
      "supporting_sources": []
    }
  ],
  "houses": [
    {
      "id": "LOC-009",
      "label": "บ้าน 2×2 เดิมของพระเอก — lookup alias ข้ามระยะไม้/หิน ไม่ใช่แบบใหม่",
      "design_target_ref": null
    }
  ],
  "facts": [
    {
      "id": "F-OWNER",
      "house_id": "LOC-009",
      "field": "owner_character_ref",
      "value": "CHAR-001",
      "observed_after_scene": "SC-008",
      "evidence": [
        {
          "source_id": "SRC-EP1",
          "locator": "L296-L348"
        },
        {
          "source_id": "SRC-CHARACTERS",
          "locator": "/characters/0/id"
        },
        {
          "source_id": "SRC-SCENES",
          "locator": "/scenes/7/pov"
        }
      ],
      "qualification": "Narrative association: protagonist builds/uses this home; not legal ownership, a new group, or an adopted archetype."
    },
    {
      "id": "F-FOOTPRINT",
      "house_id": "LOC-009",
      "field": "footprint",
      "value": "2x2",
      "observed_after_scene": "SC-008",
      "evidence": [
        {
          "source_id": "SRC-EP1",
          "locator": "L294-L332"
        }
      ],
      "qualification": "Described in the author-accepted manuscript, but its editor note labels initial completion a Bridge proposal. Not locked plot or authenticated approved canon."
    },
    {
      "id": "F-SITE",
      "house_id": "LOC-009",
      "field": "location_refs",
      "value": [
        "LOC-005"
      ],
      "observed_after_scene": "SC-008",
      "evidence": [
        {
          "source_id": "SRC-TIMELINE",
          "locator": "L8-L9"
        },
        {
          "source_id": "SRC-LOCATIONS",
          "locator": "/locations/4/id"
        },
        {
          "source_id": "SRC-SCENES",
          "locator": "/scenes/7/location_id"
        }
      ],
      "qualification": "Existing construction-site reference, not proof of an interior coordinate or later stone state."
    },
    {
      "id": "F-LOC-WOOD",
      "house_id": "LOC-009",
      "field": "location_refs",
      "value": [
        "LOC-006"
      ],
      "observed_after_scene": "SC-010",
      "evidence": [
        {
          "source_id": "SRC-TIMELINE",
          "locator": "L10"
        },
        {
          "source_id": "SRC-EP2",
          "locator": "L1-L25"
        },
        {
          "source_id": "SRC-LOCATIONS",
          "locator": "/locations/5/id"
        },
        {
          "source_id": "SRC-SCENES",
          "locator": "/scenes/9/location_id"
        }
      ]
    },
    {
      "id": "F-LOC-STONE",
      "house_id": "LOC-009",
      "field": "location_refs",
      "value": [
        "LOC-009"
      ],
      "observed_after_scene": "SC-017",
      "evidence": [
        {
          "source_id": "SRC-EP2",
          "locator": "L500-L524"
        },
        {
          "source_id": "SRC-LOCATIONS",
          "locator": "/locations/8/id"
        },
        {
          "source_id": "SRC-SCENES",
          "locator": "/scenes/16/location_id"
        }
      ],
      "qualification": "Same original home. LOC-009 is also the stable lookup alias for earlier views; that alias does not make earlier material stone."
    },
    {
      "id": "F-WOOD",
      "house_id": "LOC-009",
      "field": "main_material",
      "value": "WOOD",
      "observed_after_scene": "SC-008",
      "evidence": [
        {
          "source_id": "SRC-EP1",
          "locator": "L296-L332"
        }
      ],
      "qualification": "Described in the author-accepted manuscript, but its editor note labels initial completion a Bridge proposal. Not locked plot or authenticated approved canon."
    },
    {
      "id": "F-SHELL",
      "house_id": "LOC-009",
      "field": "construction",
      "value": {
        "source_described": "BASIC_SHELL_COMPLETE",
        "usable_evidence": "entered interior and closed wooden door"
      },
      "observed_after_scene": "SC-008",
      "evidence": [
        {
          "source_id": "SRC-EP1",
          "locator": "L296-L332"
        }
      ],
      "qualification": "Described in the author-accepted manuscript, but its editor note labels initial completion a Bridge proposal. Not locked plot or authenticated approved canon."
    },
    {
      "id": "F-LOWER",
      "house_id": "LOC-009",
      "field": "rooms",
      "value": {
        "source_area": "ground interior of four-cell footprint",
        "room_partitions": null,
        "exact_room_ids": null
      },
      "observed_after_scene": "SC-008",
      "evidence": [
        {
          "source_id": "SRC-EP1",
          "locator": "L294-L332"
        }
      ],
      "qualification": "Described in the author-accepted manuscript, but its editor note labels initial completion a Bridge proposal. Not locked plot or authenticated approved canon. Four footprint cells are not four distinct rooms. No invented internal partitions or doors."
    },
    {
      "id": "F-ROOF",
      "house_id": "LOC-009",